{
  "schema_version": "1.2.2",
  "source_policy_id": "policy-example-approved",
  "policy_version": "source-policy-2026-01",
  "source_id": "11111111-1111-4111-8111-111111111111",
  "domain_pattern": "example.org",
  "purpose": "Collect public pharmacy identity fields.",
  "allowed_operations": ["fetch", "extract", "cite"],
  "allowed_families": ["pharmacy"],
  "allowed_fields": ["identity.name", "contact.phone"],
  "allowed_content_types": ["text/html"],
  "terms_status": "approved",
  "robots_status": "allowed",
  "licensing_status": "approved",
  "copyright_status": "approved",
  "privacy_classification": "public",
  "pii_allowed": false,
  "request_interval_seconds": 60,
  "raw_retention_days": 30,
  "excerpt_limit": 1000,
  "raw_content_policy": "private_encrypted",
  "ai_vendor_allowed": false,
  "redistribution_scope": "bounded_excerpt",
  "jurisdictions": ["OM"],
  "reviewed_by": "compliance-owner-1",
  "legal_approval_reference": null,
  "reviewed_at": "2026-07-15T08:00:00Z",
  "expires_at": "2026-10-13T08:00:00Z",
  "decision": "approved",
  "reason": "Approved public-source collection policy."
}
